,title,authors
231,Handling Bias in Toxic Speech Detection: A Survey,"[('Tanmay Garg', '/author/Garg%2C+Tanmay'), ('Sarah Masud', '/author/Masud%2C+Sarah'), ('Tharun Suresh', '/author/Suresh%2C+Tharun'), ('Tanmoy Chakraborty', '/author/Chakraborty%2C+Tanmoy')]"
232,Towards emergence of communication: a cognitive developmental robotics approach,"[('Minoru Asada', '/profile/81100515894')]"
233,Do ordinary bloggers really differ from blog celebrities?,"[('Olessia Koltsova', '/profile/89758753657'), ('Sergei Koltcov', '/profile/89758841757'), ('Svetlana Alexeeva', '/profile/89758981257')]"
234,Higher Dimension Quantum Entanglement Generators,"[('Kaitlin N. Smith', '/profile/99659439423'), ('Mitchell A. Thornton', '/profile/81100443126')]"
235,Data-Driven Color Manifolds,"[('Chuong H. Nguyen', '/profile/81503643136'), ('Tobias Ritschel', '/profile/81351607404'), ('Hans-Peter Seidel', '/profile/81100315426')]"
236,Multimodal Graph Meta Contrastive Learning,"[('Feng Zhao', '/profile/99659877326'), ('Donglin Wang', '/profile/99659478866')]"
237,Challenges in designing interactive systems for emergency response,"[('Morten Kyng', '/profile/81100435567'), ('Esben Toftdahl Nielsen', '/profile/81314494414'), ('Margit Kristensen', '/profile/81311483791')]"
238,Modeling the materials handling in a container terminal using electronic real-time tracking data,"[('Yan Liu', '/profile/81485647159'), ('Soemon Takakuwa', '/profile/81100460554')]"
239,Processing Social Media Messages in Mass Emergency: A Survey,"[('Muhammad Imran', '/profile/81485650215'), ('Carlos Castillo', '/profile/81100469839'), ('Fernando Diaz', '/profile/81100278520'), ('Sarah Vieweg', '/profile/81384596988')]"
240,"Capacity, Bandwidth, and Compositionality in Emergent Language Learning","[('Cinjon Resnick', '/profile/99659336902'), ('Abhinav Gupta', '/profile/99659530143'), ('Jakob Foerster', '/profile/99659218441'), ('Andrew M. Dai', '/profile/99659048763'), ('Kyunghyun Cho', '/profile/81488664147')]"
241,Natural language generation in dialog systems,"[('Owen Rambow', '/profile/81100194456'), ('Srinivas Bangalore', '/profile/81100126548'), ('Marilyn Walker', '/profile/81100424194')]"
242,Emergence of altruism in open-ended evolution in a population of autonomous agents,"[('Jean-Marc Montanier', '/profile/81474698218'), ('Nicolas Bredeche', '/profile/81100615874')]"
243,Emergent semantics from game-induced folksonomies,"[('Lilian Weng', '/profile/81500645383'), ('Filippo Menczer', '/profile/81100513282')]"
244,The 'Fairness Doctrine' lives on?: Theorizing about the Algorithmic News Curation of Google's Top Stories,"[('Anna Kawakami', '/profile/99659527690'), ('Khonzoda Umarova', '/profile/99659370907'), ('Dongchen Huang', '/profile/99659553536'), ('Eni Mustafaraj', '/profile/81461643094')]"
245,Generative models for name disambiguation,"[('Yang Song', '/profile/81317500799'), ('Jian Huang', '/profile/81452601427'), ('Isaac G. Councill', '/profile/81100400797'), ('Jia Li', '/profile/81363603094'), ('C. Lee Giles', '/profile/81100126614')]"
246,An Objective-Based Approach for Semantic Validation of Emergence in Component-Based Simulation Models,"[('Claudia Szabo', '/profile/81330498798'), ('Yong Meng Teo', '/profile/81548017693')]"
247,Design exploration of ultra-low power non-volatile memory based on topological insulator,"[('Yuhao Wang', '/profile/81504685422'), ('Hao Yu', '/profile/81100472395')]"
248,"Emergence of learning in computer-supported, large-scale collective dynamics: a research agenda","[('Manu Kapur', '/profile/81316488825'), ('David Hung', '/profile/81316488655'), ('Michael Jacobson', '/profile/81100030660'), ('John Voiklis', '/profile/81317490061'), ('Charles K. Kinzer', '/profile/81100336595'), ('Chen Der-Thanq Victor', '/profile/81442604408')]"
249,Using Competing Bacterial Communication to Disassemble Biofilms,"[('Daniel P. Martins', '/profile/99659068408'), ('Michael T. Barros', '/profile/99659067497'), ('Sasitharan Balasubramaniam', '/profile/81314487927')]"
250,"Network communities, community networks","[('John M. Carroll', '/profile/81350576124'), ('Mary Beth Rosson', '/profile/81335496622')]"
251,"Emergence of learning in computer-supported, large-scale collective dynamics: a research agenda","[('Manu Kapur', '/profile/81316488825'), ('David Hung', '/profile/81316488655'), ('Michael Jacobson', '/profile/81100030660'), ('John Voiklis', '/profile/81317490061'), ('Charles K. Kinzer', '/profile/81100336595'), ('Chen Der-Thanq Victor', '/profile/81442604408')]"
252,Financial model within the MSW management cluster based on public-private partnership projects,"[('Aleksey Gubernatorov', '/profile/99660009204'), ('Elena Tutukina', '/profile/99660009015'), ('Elena Stepanova', '/profile/99660008806')]"
253,Deep learning benchmarks and datasets for social media image classification for disaster response,"[('Firoj Alam', '/profile/99658645960'), ('Ferda Ofli', '/profile/81558202256'), ('Muhammad Imran', '/profile/81485650215'), ('Tanvirul Alam', '/profile/99659916770'), ('Umair Qazi', '/profile/99659537823')]"
254,Using emulation to validate post-disaster network recovery solutions,"[('Razvan Beuran', '/profile/81330487996'), ('Shingo Yasuda', '/profile/81502684882'), ('Tomoya Inoue', '/profile/81493644641'), ('Shinsuke Miwa', '/profile/81392597056'), ('Yoichi Shinoda', '/profile/81100555825')]"
255,Visual Robot Programming for Generalizable Mobile Manipulation Tasks,"[('Sonya Alexandrova', '/profile/99658692176'), ('Zachary Tatlock', '/profile/81392605383'), ('Maya Cakmak', '/profile/81414594397')]"
256,Visual Assistant for Crowdsourced Anomaly Event Recognition in Smart City,"[('Minh-Tri Ho', '/profile/99659489062'), ('Trong-Tung Nguyen', '/profile/99659488809'), ('Hieu Dao', '/profile/99659489231'), ('Minh-Triet Tran', '/profile/81392613616')]"
257,Session details: Robots and emerging technologies,"[('I-Ping Hong', '/profile/99659118790')]"
258,Modeling the performance of low latency queueing for emergency telecommunications,"[('Denise M. Bevilacqua Masi', '/profile/81350587406'), ('Martin J. Fischer', '/profile/81350587586'), ('David A. Garbin', '/profile/81350580941')]"
259,Cloud-based cooperative navigation for mobile service robots in dynamic industrial environments,"[('Jannik Abbenseth', '/profile/99659172926'), ('Felipe Garcia Lopez', '/profile/99659034543'), ('Christian Henkel', '/profile/99659173203'), ('Stefan Dörr', '/profile/99659034508')]"
260,Learning to Learn and Compositionality with Deep Recurrent Neural Networks: Learning to Learn and Compositionality,"[('Nando de Freitas', '/profile/81335489736')]"
261,Software estimation using a generic-processor model,"[('Jie Gong', '/profile/81100009770'), ('D. D. Gajski', '/profile/81502706434'), ('S. Narayan', '/profile/81100186344')]"
262,Why E-Servicescape Matters for Positive Word-of-Mouth: An Empirical Study in Online Food Delivery Service During COVID-19 Pandemic in Indonesia,"[('Darjat Sudrajat', '/profile/99659732324')]"
263,Winning an Election: On Emergent Strategic Communication in Multi-Agent Networks,"[('Shubham Gupta', '/profile/99659338498'), ('Ambedkar Dukkipati', '/profile/99660268182')]"
264,Emergence of human language: a DEVS-based systems approach,"[('Bernard P Zeigler', '/profile/81452614233')]"
265,A cognitive account of collective emergence in design,"[('Benjamin G. Shaw', '/profile/81413602085')]"
266,Robust convention emergence in social networks through self-reinforcing structures dissolution,"[('Daniel Villatoro', '/profile/81436594336'), ('Jordi Sabater-Mir', '/profile/81341496047'), ('Sandip Sen', '/profile/81100401673')]"
267,Session details: Mixed Topics: Emerging Topics + Internet Plus Government + Organizational Factor,"[('Karen Mossberger', '/profile/81311483661')]"
268,Blockchain-based Reputation Evaluation Using Game Theory in Social Networking,"[('Wenjie Guo', '/profile/99660370063'), ('Jingfeng Xue', '/profile/81447600455'), ('Yong Wang', '/profile/99659393038'), ('Zhixiong Zhou', '/profile/99660365587')]"
269,"Emergent Interaction: Complexity, Dynamics, and Enaction in HCI","[('Dan Bennett', '/profile/99659526751'), ('Alan Dix', '/profile/81100537116'), ('Parisa Eslambolchilar', '/profile/81350582010'), ('Feng Feng', '/profile/99659702051'), ('Tom Froese', '/profile/81384617703'), ('Vassilis Kostakos', '/profile/81100283202'), ('Sebastien Lerique', '/profile/99659700491'), ('Niels van Berkel', '/profile/99658743711')]"
270,On Detecting Policy-Related Political Ads: An Exploratory Analysis of Meta Ads in 2022 French Election,"[('Vera Sosnovik', '/author/Sosnovik%2C+Vera'), ('Romaissa Kessi', '/author/Kessi%2C+Romaissa'), ('Maximin Coavoux', '/author/Coavoux%2C+Maximin'), ('Oana Goga', '/author/Goga%2C+Oana')]"
271,Toward safe interoperations in network connected medical cyber-physical systems using open-loop safe protocols,"[('Andrew Y.-Z. Ou', '/profile/99659088659'), ('Maryam Rahmaniheris', '/profile/81313480940'), ('Yu Jiang', '/profile/82658667557'), ('Po-Liang Wu', '/profile/81461647343'), ('Lui Sha', '/profile/81100436936')]"
272,Implementation of Cognitive Driver Models in Microscopic Traffic Simulations,"[('Roland Cristea', '/profile/99659090186'), ('Stefan Rulewitz', '/profile/99659090833'), ('Ilja Radusch', '/profile/81321496890'), ('Karl Hübner', '/profile/99658746676'), ('Björn Schünemann', '/profile/81392602341')]"
273,Information technology and the emergence of a worker-centered organization,"[('Patricia A. Carlson', '/profile/81100379063')]"
274,Research Challenges of Emerging Technologies Supporting Life-Long Health and Wellbeing,"[('Jochen Meyer', '/profile/81500657671'), ('Parisa Eslambolchilar', '/profile/81350582010')]"
275,MegaFlow2D: A Parametric Dataset for Machine Learning Super-resolution in Computational Fluid Dynamics Simulations,"[('Wenzhuo Xu', '/author/Xu%2C+Wenzhuo'), ('Noelia Grande Gutierrez', '/author/Grande+Gutierrez%2C+Noelia'), ('Christopher McComb', '/author/McComb%2C+Christopher')]"
276,Using simulation to help hospitals reduce emergency department waiting times: examples and impact,"[('Thomas Monks', '/profile/81485650081'), ('Rudabeh Meskarian', '/profile/99658621359')]"
277,Emergent Spatial Agent Segregation,"[('K. A. Hawick', '/profile/81100188223'), ('C. J. Scogings', '/profile/81100346631')]"
278,Corpus design for biomedical natural language processing,"[('K. Bretonnel Cohen', '/profile/81346487867'), ('Philip V. Ogren', '/profile/81324492267'), ('Lynne Fox', '/profile/81350599925'), ('Lawrence Hunter', '/profile/81406593319')]"
279,A neurorobotics approach to investigating the emergence of communication in robots,"[('Jungsik Hwang', '/profile/81501650472'), ('Nadine Wirkuttis', '/profile/99659491339'), ('Jun Tani', '/profile/81100242888')]"
280,"Un Grano de Arena: Infrastructural Care, Social Media Platforms, and the Venezuelan Humanitarian Crisis","[('Michaelanne Dye', '/profile/81553689056')]"
281,Sustainabot - Exploring the Use of Everyday Foodstuffs as Output and Input for and with Emergent Users,"[('Simon Robinson', '/profile/81371592031'), ('Jennifer Pearson', '/profile/81384596881'), ('Mark D. Holton', '/profile/99659365427'), ('Shashank Ahire', '/profile/99658659910'), ('Matt Jones', '/profile/81328488881')]"
282,Using conceptual blending to describe emergent meaning in wave propagation,"[('Michael C. Wittmann', '/profile/81442611177')]"
283,Designing a Smart Speaker for Emergent Users: Human Plus AI Response,"[('Shashank Ahire', '/profile/99660689870')]"
284,In-memory computing in emerging memory technologies for machine learning: an overview,"[('Kaushik Roy', '/profile/81100654574'), ('Indranil Chakraborty', '/profile/99659369412'), ('Mustafa Ali', '/profile/99659370422'), ('Aayush Ankit', '/profile/99659178682'), ('Amogh Agrawal', '/profile/99659368353')]"
285,Challenges developing and teaching online professional courses for technical graduate programs: panel discussion,"[('Ajay Bandi', '/author/Bandi%2C+Ajay'), ('Denise Case', '/author/Case%2C+Denise'), ('Nathan Eloe', '/author/Eloe%2C+Nathan'), ('Aziz Fellah', '/author/Fellah%2C+Aziz'), ('Charles Hoot', '/author/Hoot%2C+Charles')]"
286,Emergence of Cooperation in Complex Agent Networks Based on Expectation of Cooperation: (Extended Abstract),"[('Ryosuke Shibusawa', '/profile/99658664391'), ('Tomoaki Otsuka', '/profile/87959161057'), ('Toshiharu Sugawara', '/profile/81100212247')]"
287,Deep learning the ising model near criticality,"[('Alan Morningstar', '/profile/99659287315'), ('Roger G. Melko', '/profile/99659288045')]"
288,Universal protocols for information dissemination using emergent signals,"[('Bartłomiej Dudek', '/profile/99659277993'), ('Adrian Kosowski', '/profile/81318494688')]"
289,Conducting a Large-scale Field Test of a Smartphone-based Communication Network for Emergency Response,"[('Flor Álvarez', '/profile/99659314354'), ('Lars Almon', '/profile/99659314945'), ('Patrick Lieser', '/profile/99658733581'), ('Tobias Meuser', '/profile/99659314824'), ('Yannick Dylla', '/profile/99659314226'), ('Björn Richerzhagen', '/profile/82858760057'), ('Matthias Hollick', '/profile/81100325093'), ('Ralf Steinmetz', '/profile/81100171846')]"
290,"Capacity, Bandwidth, and Compositionality in Emergent Language Learning","[('Cinjon Resnick', '/profile/99659336902'), ('Abhinav Gupta', '/profile/99659530143'), ('Jakob Foerster', '/profile/99659218441'), ('Andrew M. Dai', '/profile/99659048763'), ('Kyunghyun Cho', '/profile/81488664147')]"
291,Towards emergence of communication: a cognitive developmental robotics approach,"[('Minoru Asada', '/profile/81100515894')]"
292,Learning Driven Mobility Control of Airborne Base Stations in Emergency Networks,"[('Rui Li', '/profile/99659075614'), ('Chaoyun Zhang', '/profile/99659225879'), ('Paul Patras', '/profile/81456635505'), ('Razvan Stanica', '/profile/81488671225'), ('Fabrice Valois', '/profile/81100131588')]"
293,Open and regionalised spectrum repositories for emerging countries,"[('Andres Arcia Moret', '/profile/99659047996'), ('Arjuna Sathiaseelan', '/profile/81316490754'), ('Marco Zenaro', '/profile/84460081357'), ('Freddy Rondon', '/profile/99659048791'), ('Ermanno Pietrosemoli', '/profile/81367599379'), ('David Johnson', '/profile/99659047476')]"
294,Detecting Emergent Intersectional Biases: Contextualized Word Embeddings Contain a Distribution of Human-like Biases,"[('Wei Guo', '/profile/99659840964'), ('Aylin Caliskan', '/profile/81508689525')]"
295,Shedding Light: Integrating Bioimaging Technologies into the Design of an Interactive Museum Exhibit,"[('Joyce Ma', '/profile/99659388644'), ('Eyal Shahar', '/profile/99659441940'), ('Kevin Eliceiri', '/profile/81443597313'), ('Guneet Mehta', '/profile/99659442373'), ('Kristina Yu', '/profile/99659442161')]"
296,Performance Impact of Emerging Memory Technologies on Big Data Applications: A Latency-Programmable System Emulation Approach,"[('Mu-Tien Chang', '/profile/99659216621'), ('I. Stephen Choi', '/profile/99658757827'), ('Dimin Niu', '/profile/81466645127'), ('Hongzhong Zheng', '/profile/81361605041')]"
297,Emergence of altruism in open-ended evolution in a population of autonomous agents,"[('Jean-Marc Montanier', '/profile/81474698218'), ('Nicolas Bredeche', '/profile/81100615874')]"
298,Phase diagram for two-layer ReLU neural networks at infinite-width limit,"[('Tao Luo', '/author/Luo%2C+Tao'), ('Zhi-Qin John Xu', '/author/Xu%2C+Zhi-Qin+John'), ('Zheng Ma', '/author/Ma%2C+Zheng'), ('Yaoyu Zhang', '/author/Zhang%2C+Yaoyu')]"
299,Numerical computing on the web: benchmarking for the future,"[('David Herrera', '/profile/99659303025'), ('Hanfeng Chen', '/profile/99659179327'), ('Erick Lavoie', '/profile/81490696105'), ('Laurie Hendren', '/profile/81100646110')]"
300,"Interact, excite, and feel","[('Parisa Eslambolchilar', '/profile/81350582010'), ('Rod Murray-Smith', '/profile/81100572841')]"
301,Information technology and the emergence of a worker-centered organization,"[('Patricia A. Carlson', '/profile/81100379063')]"
302,Performance Considerations for Edge Blockchain Systems in Emerging 5G Data Networks,"[('Dilip Krishnaswamy', '/profile/99658669108')]"
303,Myopic and Non-myopic Communication under Partial Observability,"[('Alan Carlin', '/profile/81365596099'), ('Shlomo Zilberstein', '/profile/81100061211')]"
304,Serverless Computing and Cloud Function-based Applications,"[('Josef Spillner', '/profile/81436593803')]"
305,Symbolic reasoning for automatic signal placement,"[('Kostas Ferles', '/profile/99659178776'), ('Jacob Van Geffen', '/profile/99659178860'), ('Isil Dillig', '/profile/81331491247'), ('Yannis Smaragdakis', '/profile/81100614708')]"
306,Networked Multi-Agent Reinforcement Learning with Emergent Communication,"[('Shubham Gupta', '/profile/99659338498'), ('Rishi Hazra', '/profile/99659530145'), ('Ambedkar Dukkipati', '/profile/99660268182')]"
307,The emergence of software diversity in maven central,"[('César Soto-Valero', '/profile/99659286914'), ('Amine Benelallam', '/profile/99658680521'), ('Nicolas Harrand', '/profile/99659075330'), ('Olivier Barais', '/profile/81100154033'), ('Benoit Baudry', '/profile/81100407522')]"
308,Controversies and opinion,"[('Allen Reiter', '/profile/81332523092')]"
309,Generic quantum Fourier transforms,"[('Cristopher Moore', '/profile/81331499959'), ('Daniel Rockmore', '/profile/81100636775'), ('Alexander Russell', '/profile/81100588915')]"
310,Evaluation of emerging educational technologies in the classroom,"[('Ahmed Kharrufa', '/profile/81479662079'), ('Serdar Abaci', '/profile/81502812644'), ('Emeline Brulé', '/profile/99658765641'), ('Petr Slovak', '/profile/81435611500'), ('Megan Venn-Wycherley', '/profile/99659365983'), ('Daniel Lambton-Howard', '/profile/99659366417')]"
311,Session details: Healthcare applications: Emergency departments,"[('Xiaolan Xie', '/profile/99659356287'), ('Maria Mayorga', '/profile/99659412840')]"
312,Designing Emergent Swarm Behaviors using Behavior Trees and Grammatical Evolution,"[('Aadesh Neupane', '/profile/99659280839'), ('Michael A. Goodrich', '/profile/81350575550')]"
313,A classical leash for a quantum system: command of quantum systems via rigidity of CHSH games,"[('Ben W. Reichardt', '/profile/81100216023'), ('Falk Unger', '/profile/81342514273'), ('Umesh Vazirani', '/profile/81100201963')]"
314,Satellite grouping and routing protocol for LEO/MEO satellite IP networks,"[('Chao Chen', '/profile/81331490456'), ('Eylem Ekici', '/profile/81100577558'), ('Ian F. Akyildiz', '/profile/81100069285')]"
315,Community based emergency response,"[('David Lorenzi', '/profile/81481644748'), ('Jaideep Vaidya', '/profile/81100496660'), ('Soon Chun', '/profile/81452602572'), ('Basit Shafiq', '/profile/81100322125'), ('Varuna Naik', '/profile/81758613757'), ('Vijayalakshmi Atluri', '/profile/81100274477'), ('Nabil Adam', '/profile/81100597393')]"
316,Norm Emergence in Multiagent Systems: A Viewpoint Paper,"[('Andreasa Morris-Martin', '/profile/99659530159'), ('Marina De Vos', '/profile/81460642129'), ('Julian Padget', '/profile/81100470382')]"
317,Towards small world emergence,"[('Philippe Duchon', '/profile/81317488525'), ('Nicolas Hanusse', '/profile/81100391285'), ('Emmanuelle Lebhar', '/profile/81100281896'), ('Nicolas Schabanel', '/profile/81100488507')]"
318,"""Help! Can You Hear Me?"": Understanding How Help-Seeking Posts are Overwhelmed on Social Media during a Natural Disaster","[('Changyang He', '/profile/99659900877'), ('Yue Deng', '/profile/99660643089'), ('Wenjie Yang', '/profile/99659548038'), ('Bo Li', '/profile/81409595864')]"
319,On Algorithmic Decision Procedures in Emergency Response Systems in Smart and Connected Communities,"[('Geoffrey Pettet', '/profile/99659359348'), ('Ayan Mukhopadhyay', '/profile/99659026499'), ('Mykel Kochenderfer', '/profile/81442616197'), ('Yevgeniy Vorobeychik', '/profile/81314492468'), ('Abhishek Dubey', '/profile/81312482618')]"
320,Overlapping coalition formation games: charting the tractability frontier,"[('Yair Zick', '/profile/81488672802'), ('Georgios Chalkiadakis', '/profile/81100043278'), ('Edith Elkind', '/profile/81331491851')]"
321,Towards a predictive model architecture for current or emergent pandemic situations,"[('Fortune S. Mhlanga', '/profile/81100199976'), ('E. L. Perry', '/profile/84758737957'), ('Ching-Song Wei', '/profile/84758628457'), ('Peter A. Ng', '/profile/84758625757')]"
322,"What's kooking?: characterizing India's emerging social network, Koo","[('Asmit Kumar Singh', '/profile/99659972785'), ('Chirag Jain', '/profile/99659749367'), ('Jivitesh Jain', '/profile/99659965531'), ('Rishi Raj Jain', '/profile/99659964444'), ('Shradha Sehgal', '/profile/99659856836'), ('Tanisha Pandey', '/profile/99659977721'), ('Ponnurangam Kumaraguru', '/profile/81328489236')]"
323,Emergent properties in ad-hoc networks: a security perspective,"[('Virgil D. Gligor', '/profile/81100240914')]"
324,Event-based classification of social media streams,"[('Timo Reuter', '/profile/81503671785'), ('Philipp Cimiano', '/profile/81100623599')]"
325,Evolutionary music composition based on Zipf's law,"[('Johannes H. Jensen', '/profile/81486644103'), ('Pauline C. Haddow', '/profile/81100311007')]"
326,Emergence of altruism in open-ended evolution in a population of autonomous agents,"[('Jean-Marc Montanier', '/profile/81474698218'), ('Nicolas Bredeche', '/profile/81100615874')]"
327,Multimodal Emergent Fake News Detection via Meta Neural Process Networks,"[('Yaqing Wang', '/profile/99659731715'), ('Fenglong Ma', '/profile/99658733425'), ('Haoyu Wang', '/profile/99659851079'), ('Kishlay Jha', '/profile/99659287019'), ('Jing Gao', '/profile/81440599637')]"
328,Emergence of invariance and disentanglement in deep representations,"[('Alessandro Achille', '/profile/99659345025'), ('Stefano Soatto', '/profile/81502745004')]"
329,Cultural and linguistic localization of games to bridge the digital and cultural divide in indigenous populations,"[('Joan Byamugisha', '/profile/99658685644'), ('Laurianne Sitbon', '/profile/81363592880'), ('Margot Brereton', '/profile/81100017862')]"
330,Evolving recurrent neural networks for emergent communication,"[('Joshua Sirota', '/profile/99659444767'), ('Vadim Bulitko', '/profile/81100495232'), ('Matthew R G Brown', '/profile/99659524453'), ('Sergio Poo Hernandez', '/profile/99659085148')]"
331,Design and Characteristic Analysis of Variable Buoyancy System for Long Range Autonomous Underwater Vehicle,"[('Zhaoyang Sun', '/profile/99659467131'), ('Jiancheng Yu', '/profile/99658660436'), ('Aiqun Zhang', '/profile/81467656126'), ('Yan Huang', '/profile/99659467748'), ('Zhenyu Wang', '/profile/99659468056')]"
332,Evolution of quantum algorithms,"[('Lee Spector', '/profile/81100520221')]"
333,Evidence of long range dependence and self-similarity in urban traffic systems,"[('Gautam S. Thakur', '/profile/81464641077'), ('Pan Hui', '/profile/81548028286'), ('Ahmed Helmy', '/profile/81100223430')]"
334,"Hide and Seek, and the Emergence of Randomness in a Population of Deterministic Agents","[('Robin Clark', '/profile/99659277349'), ('Steven Kimbrough', '/profile/99659277634')]"
335,Emergent semantics from game-induced folksonomies,"[('Lilian Weng', '/profile/81500645383'), ('Filippo Menczer', '/profile/81100513282')]"
336,Descrambling the social TV echo chamber,"[('Nitya Narasimhan', '/profile/81100599610'), ('Venu Vasudevan', '/profile/81100090040')]"
337,The emergence and growth of evolutionary art: 1980--1993,"[('Nicholas Lambert', '/profile/81467640938'), ('William Latham', '/profile/81100545095'), ('Frederic Fol Leymarie', '/profile/81758954157')]"
338,Emergent Behavior in System-of-Systems: A Systematic Mapping Study,"[('Thiago J. Inocêncio', '/profile/99659458530'), ('Gustavo R. Gonzales', '/profile/99659458345'), ('Everton Cavalcante', '/profile/81492655455'), ('Flávio E. A. Horita', '/profile/99659161683')]"
339,Use of genetic algorithms in three-dimensional reconstruction in carbon black aggregates,"[('Robert J. Grim', '/profile/81332501999'), ('J. Richard Rinewalt', '/profile/81538497256'), ('L. Donnell Payne', '/profile/81100557841')]"
340,pakapaka Method For BLE Beacon Identification,"[('Shota Ikeda', '/profile/99659093375'), ('Katsuhiko Kaji', '/profile/81310494595')]"
341,A multiagent system manages collaboration in emergent processes,"[('John Debenham', '/profile/81100407062')]"
342,Evolution of Complex Emergent Behaviour in Multi-State Cellular Automata,"[('Michal Bidlo', '/profile/81375607657')]"
343,Harnessing emergence: the control and design of emergent behavior in system of systems engineering,"[('Saurabh Mittal', '/profile/81337491891'), ('Larry Rainey', '/profile/81100422611')]"
344,Moiré cryptography,"[('Yvo Desmedt', '/profile/81100599384'), ('Tri van Le', '/profile/81100276218')]"
345,Emergent ad hoc sensor network connectivity in large-scale disaster zones,"[('Osher Yadgar', '/profile/81100293733')]"
346,Global chaos synchronization of Arneodo chaotic system via backstepping controller design,"[('Sundarapandian Vaidyanathan', '/profile/81508689953')]"
347,Interference radius in PCS radio resource management simulations,"[('Michael Liljenstam', '/profile/81100317989'), ('Rassul Ayani', '/profile/81100419018')]"
348,Using machine learning for handover optimization in vehicular fog computing,"[('Salman Memon', '/profile/99659366650'), ('Muthucumaru Maheswaran', '/profile/81100094438')]"
349,Phase transitions in group testing,"[('Jonathan Scarlett', '/profile/99658668739'), ('Volkan Cevher', '/profile/81336488297')]"
350,An Objective-Based Approach for Semantic Validation of Emergence in Component-Based Simulation Models,"[('Claudia Szabo', '/profile/81330498798'), ('Yong Meng Teo', '/profile/81548017693')]"
351,Modeling and simulation of steady state and transient behaviors for emergent SoCs,"[('JoAnn M. Paul', '/profile/81452605713'), ('Arne J. Suppé', '/profile/81100076397'), ('Donald E. Thomas', '/profile/81100412140')]"
