,title,authors
352,Carbon nanotube field-effect transistors and logic circuits,"[('R. Martel', '/profile/81100371443'), ('V. Derycke', '/profile/81100644923'), ('J. Appenzeller', '/profile/81100504402'), ('S. Wind', '/profile/81100607440'), ('Ph. Avouris', '/profile/81100274671')]"
353,UAV based 5G indoor localization for emergency services,"[('Oluwatayo Y. Kolawole', '/profile/99660342104'), ('Mythri Hunukumbure', '/profile/99659829171')]"
354,Emergence of community structures in vowel inventories: an analysis based on complex networks,"[('Animesh Mukherjee', '/profile/81100653390'), ('Monojit Choudhury', '/profile/81313483944'), ('Anupam Basu', '/profile/81100646311'), ('Niloy Ganguly', '/profile/81100305563')]"
355,Work-function variation induced fluctuation in bias-temperature-instability characteristics of emerging metal-gate devices and implications for digital design,"[('Seid Hadi Rasouli', '/profile/81310482323'), ('Kazuhiko Endo', '/profile/81458651974'), ('Kaustav Banerjee', '/profile/81100144463')]"
356,Emerging user interfaces through first-class viewers,"[('Rick Mugridge', '/profile/81100509430'), ('Mitra Nataraj', '/profile/81503689700'), ('Darryl Singh', '/profile/81503685455')]"
357,"Emergence of learning in computer-supported, large-scale collective dynamics: a research agenda","[('Manu Kapur', '/profile/81316488825'), ('David Hung', '/profile/81316488655'), ('Michael Jacobson', '/profile/81100030660'), ('John Voiklis', '/profile/81317490061'), ('Charles K. Kinzer', '/profile/81100336595'), ('Chen Der-Thanq Victor', '/profile/81442604408')]"
358,From object evolution to object emergence,"[('Dalila Tamzalit', '/profile/81100662350'), ('Chabane Oussalah', '/profile/81100047246')]"
359,Distributed Heterogeneous Robot-Human Teams: Robotics Track,"[('S M Al Mahi', '/profile/99659309756'), ('Kyungho Nam', '/profile/99659368528'), ('Christopher Crick', '/profile/81309494479')]"
360,Controlling the effects of anomalous ARP behaviour on ethernet networks,"[('D. Ármannsson', '/profile/81310483756'), ('G. Hjálmtýsson', '/profile/81100082838'), ('P. D. Smith', '/profile/81310487512'), ('L. Mathy', '/profile/81310493238')]"
361,Emergence of stable coalitions via task exchanges,"[('Partha Sarathi Dutta', '/profile/81100634439'), ('Sandip Sen', '/profile/81100401673')]"
362,Zero-shot Generalization of Multimodal Dialogue Agents,"[('Diogo Tavares', '/profile/99660640315')]"
363,Predicting emerging social conventions in online social networks,"[('Farshad Kooti', '/profile/81501684651'), ('Winter A. Mason', '/profile/81442596219'), ('Krishna P. Gummadi', '/profile/81100334131'), ('Meeyoung Cha', '/profile/81100205660')]"
364,Racism is a virus: anti-asian hate and counterspeech in social media during the COVID-19 crisis,"[('Bing He', '/profile/99659850401'), ('Caleb Ziems', '/profile/99659971810'), ('Sandeep Soni', '/profile/87958751357'), ('Naren Ramakrishnan', '/profile/81350601212'), ('Diyi Yang', '/profile/87258642957'), ('Srijan Kumar', '/profile/89558825057')]"
365,Emerging challenges for large scale systems integration,"[('Andrew Fano', '/profile/81100313988')]"
366,Inflationary fixed points in modal logic,"[('Anuj Dawar', '/profile/81100341382'), ('Erich Grädel', '/profile/81100568848'), ('Stephan Kreutzer', '/profile/81100206918')]"
367,Creating emergent behaviors: two robotics labs that combine reactive behaviors,"[('Robert M. Harlan', '/profile/81100207922'), ('Shelley McClarigan', '/profile/81100173961')]"
368,Towards a Dynamic Inter-Sensor Correlations Learning Framework for Multi-Sensor-Based Wearable Human Activity Recognition,"[('Shenghuan Miao', '/profile/99660567182'), ('Ling Chen', '/profile/81408598829'), ('Rong Hu', '/profile/99660566458'), ('Yingsong Luo', '/profile/99660566610')]"
369,A Carrier-Based Analytic Model for Undoped (Lightly Doped) Ultra-Thin-Body Silicon-on-Insulator (UTB-SOI) MOSFETs,"[('Jin He', '/profile/81100331866'), ('Xing Zhang', '/profile/81312481890'), ('Ganggang Zhang', '/profile/81312481251'), ('Yangyuan Wang', '/profile/81312485573')]"
370,DP-cryptography: marrying differential privacy and cryptography in emerging applications,"[('Sameer Wagh', '/profile/99660009977'), ('Xi He', '/profile/89758898557'), ('Ashwin Machanavajjhala', '/profile/81100002416'), ('Prateek Mittal', '/profile/81375616228')]"
371,Thing Constellation Visualizer: Exploring Emergent Relationships of Everyday Objects,"[('Yi-Ching (Janet) Huang', '/profile/99659895672'), ('Yu-Ting Cheng', '/profile/99659276837'), ('Rung-Huei Liang', '/profile/99659899018'), ('Jane Yung-jen Hsu', '/profile/81406599584'), ('Lin-Lin Chen', '/profile/99658706963')]"
372,Safe deployment for reconfigurable cyber-physical systems,"[('Uwe Pohlmann', '/profile/81758850257')]"
373,Evolving recurrent neural networks for emergent communication,"[('Joshua Sirota', '/profile/99659444767'), ('Vadim Bulitko', '/profile/81100495232'), ('Matthew R G Brown', '/profile/99659524453'), ('Sergio Poo Hernandez', '/profile/99659085148')]"
374,Emerging (un-)reliability based security threats and mitigations for embedded systems: special session,"[('Hussam Amrouch', '/profile/81482661250'), ('Prashanth Krishnamurthy', '/profile/81343497177'), ('Naman Patel', '/profile/99659136792'), ('Jörg Henkel', '/profile/81350581911'), ('Ramesh Karri', '/profile/81100444190'), ('Farshad Khorrami', '/profile/81343496809')]"
375,Trustworthy Device Pairing for Opportunistic Device-to-Device Communications in Mobile Crowdsourcing Systems,"[('Cong Zhao', '/profile/99659825654'), ('Fengrui Shi', '/profile/99658740799'), ('Ran Huang', '/profile/99658731386'), ('Xinyu Yang', '/profile/81413599518'), ('Julie McCann', '/profile/81100223499')]"
376,Automatic title generation for EM,"[('Paul E. Kennedy', '/profile/81547898156'), ('Alexander G. Hauptmann', '/profile/81100535010')]"
377,Towards analyzing Chinese crisis cases spatiotemporally,"[('Jian Zhan', '/profile/81385597217'), ('Ning An', '/profile/81100329696'), ('Lian Li', '/profile/81384612868'), ('Yongzhong Sha', '/profile/81351596537')]"
378,Open and regionalised spectrum repositories for emerging countries,"[('Andres Arcia Moret', '/profile/99659047996'), ('Arjuna Sathiaseelan', '/profile/81316490754'), ('Marco Zenaro', '/profile/84460081357'), ('Freddy Rondon', '/profile/99659048791'), ('Ermanno Pietrosemoli', '/profile/81367599379'), ('David Johnson', '/profile/99659047476')]"
379,Reusable C++ code for an electron-phonon simulation,"[('Sandria N. Kerr', '/profile/81100007606'), ('Guanghui Lei', '/profile/81100482205'), ('William C. Kerr', '/profile/81542448756')]"
380,Harnessing emergence: the control and design of emergent behavior in system of systems engineering,"[('Saurabh Mittal', '/profile/81337491891'), ('Larry Rainey', '/profile/81100422611')]"
381,Algorithm 111: Molecular-orbital calculation of molecular interactions,"[('Yuri A. Kruglyak', '/profile/81100288752'), ('Donald R. Whitman', '/profile/81100008077')]"
382,Harnessing emergence: the control and design of emergent behavior in system of systems engineering,"[('Saurabh Mittal', '/profile/81337491891'), ('Larry Rainey', '/profile/81100422611')]"
383,Electric field phase sensing for wearable orientation and localisation applications,"[('Daniel Roggen', '/profile/81100062927'), ('Arash Pour Yazdan', '/profile/99659069840'), ('Francisco Javier Ordóñez Morales', '/profile/99659069686'), ('Robert J. Prance', '/profile/81430602761'), ('Helen Prance', '/profile/81430662062')]"
384,Grand challenges to computation science,"[('Eugene Levin', '/profile/81100404625')]"
385,The emergence of true machine intelligence in the twenty-first century (abstract),"[('Raymond Kurzweil', '/profile/81100034327')]"
386,An interactive tool for enhancing hospital capacity predictions using an epidemiological model,"[('F. Gibson', '/profile/99659804473'), ('R. Fabbro', '/profile/99659804639'), ('A. Rahat', '/profile/99660648553'), ('T. Torsney-Weir', '/profile/81490691977'), ('D. Archambault', '/profile/99659817386'), ('M. Gravenor', '/profile/99659817113'), ('B. Lucini', '/profile/99659806238')]"
387,"Evaluation of Black hole, Wormhole and Sybil Attacks in Mobile Ad-hoc Networks","[('Sunil Kumar Jangir', '/profile/99659068609'), ('Naveen Hemrajani', '/profile/82258726257')]"
388,Stop building castles on a swamp!: the crisis of reproducing automatic search in evidence-based software engineering,"[('Zheng Li', '/profile/99659579605')]"
389,Universal protocols for information dissemination using emergent signals,"[('Bartłomiej Dudek', '/profile/99659277993'), ('Adrian Kosowski', '/profile/81318494688')]"
390,Towards emergence of communication: a cognitive developmental robotics approach,"[('Minoru Asada', '/profile/81100515894')]"
391,The Emergence of Quantified Self as a Data-driven Movement to Promote Health and Wellness,"[('Maarten den Braber', '/profile/99659077716')]"
392,Time-based adaptive collision-avoidance real-time MAC protocol for underwater acoustic sensor networks,"[('Xiaoxiao Zhuo', '/profile/99659331960'), ('Fengzhong Qu', '/profile/81453639810'), ('Hong Yang', '/profile/99659332155'), ('Yezhou Wu', '/profile/82858642257')]"
393,Information handling in an arms control inspection and verification environment,"[('L. F. Mathison', '/profile/81385604324')]"
394,Training Strategies to Handle Missing Modalities for Audio-Visual Expression Recognition,"[('Srinivas Parthasarathy', '/profile/99659667058'), ('Shiva Sundaram', '/profile/99659667890')]"
395,Asynchronous event handling in the real-time specification for Java,"[('MinSeong Kim', '/profile/81337490440'), ('Andy Wellings', '/profile/81100235181')]"
396,Computational seismic analysis of optical instrument structures: Computational analysis of seismic response of wide-field optical spectrograph structures in large telescopes,"[('Aman Shrestha', '/profile/99659906992'), ('Daxu Zhang', '/profile/99659907394'), ('Lingyu Zheng', '/profile/99659906582')]"
397,"Your 2 is My 1, Your 3 is My 9: Handling Arbitrary Miscalibrations in Ratings","[('Jingyan Wang', '/profile/99659369279'), ('Nihar B. Shah', '/profile/81461646996')]"
398,"Towards Intersectionality in Machine Learning: Including More Identities, Handling Underrepresentation, and Performing Evaluation","[('Angelina Wang', '/profile/99660487432'), ('Vikram V Ramaswamy', '/profile/99660486379'), ('Olga Russakovsky', '/profile/81550142556')]"
399,Incorporating Chorus Line Effect into a Cucker-Smale System for Fast Manoeuvre Tracking,"[('Jing Ma', '/profile/99659283191'), ('Edmund M-K Lai', '/profile/99659284137')]"
400,A Fitness Monitoring System based on Fusion of Visual and Sensorial Information,"[('Michalis Papakostas', '/profile/99658677012'), ('Theodore Giannakopoulos', '/profile/81440618760'), ('Vangelis Karkaletsis', '/profile/81100618912')]"
401,Emergent participant interaction,"[('Jennifer Seevinck', '/profile/81100515420'), ('Ernest A. Edmonds', '/profile/81100163076'), ('Linda Candy', '/profile/81100029719')]"
402,Measuring Impact of Academic Research in Computer and Information Science on Society,"[('Kushwanth Koya', '/profile/99659210772'), ('Gobinda Chowdhury', '/profile/81100512197')]"
403,Algorithm 391: Unitary symmetric polynomials,"[('John McKay', '/profile/81100556078')]"
404,Driving Next to Automated Vehicles: Emergent Human-machine Cooperation in Mixed Traffic,"[('Yutong Zhang', '/profile/99660781306'), ('Shihong Ling', '/profile/99660782402'), ('Edmond Awad', '/profile/99659109069'), ('Morgan R. Frank', '/profile/99660780667'), ('Na Du', '/profile/99660780127')]"
405,Emerging security mechanisms for medical cyber physical systems,"[('Ovunc Kocabas', '/profile/81392618642'), ('Tolga Soyata', '/profile/81100073037'), ('Mehmet K. Aktas', '/profile/99658964382')]"
406,Interactive depth first algorithm for oil transportation emergency response planning,"[('Victor Romanov', '/profile/84758678457'), ('Ilya Moskovoy', '/profile/84758718557'), ('Kseniya Grigoryeva', '/profile/84758722357')]"
407,Emerging technologies to support supply chain management,"[('Nitin Singh', '/profile/81321488361')]"
408,Mission-aware time-dependent cyber asset criticality and resilience,"[('Hasan Cam', '/profile/81555778956'), ('Pierre Mouallem', '/profile/81436603018')]"
